{
  "$schema": "https://json-schema.org/draft/2020-12/schema",
  "$schemaVersion": "0.0.1",
  "$id": "https://raw.githubusercontent.com/smart-data-models/Candidates/master/standards/gaiax-ontology-v2111/models/Resource/schema.json",
  "modelTags": "GaiaX,Ontology,Infrastructure",
  "title": "Smart Data Models - Gaia-X Ontology - Resource",
  "description": "https://w3id.org/gaia-x/2.1.11#class/Resource. Description of a good or object of the Gaia-X Ecosystem, and may be aggregated in a Service Offering or exist independently of it. Subclass of GaiaXEntity per the Gaia-X ontology; inherited properties are documented on the GaiaXEntity model and not repeated here. The source ontology marks this class as abstract, not intended for direct instantiation.",
  "type": "object",
  "properties": {
    "id": {
      "type": "string",
      "format": "uri",
      "description": "Property. Unique identifier of the entity"
    },
    "type": {
      "type": "string",
      "enum": [
        "Resource"
      ],
      "description": "Property. NGSI-LD Entity type. It must be equal to 'Resource'"
    },
    "dateCreated": {
      "type": "string",
      "format": "date-time",
      "description": "Property. Model:'https://schema.org/DateTime'. Entity creation timestamp."
    },
    "dateModified": {
      "type": "string",
      "format": "date-time",
      "description": "Property. Model:'https://schema.org/DateTime'. Timestamp of the last modification."
    },
    "source": {
      "type": "string",
      "description": "Property. A sequence of characters giving the source of the entity data."
    },
    "dataProvider": {
      "type": "string",
      "description": "Property. A sequence of characters identifying the provider of the harmonised data entity."
    },
    "aggregationOfResources": {
      "type": "array",
      "items": {
        "type": "string",
        "format": "uri"
      },
      "description": "Relationship. Resources related to the resource and that can exist independently of it. Links to one or more Resource entities."
    }
  },
  "required": [
    "id",
    "type"
  ]
}
