{
  "id": "urn:ngsi-ld:Resource:001",
  "type": "Resource",
  "dateCreated": "2026-08-20T10:00:00Z",
  "dateModified": "2026-08-20T10:00:00Z",
  "source": "https://docs.gaia-x.eu/ontology/v2111/classes/Resource/",
  "dataProvider": "Gaia-X AISBL",
  "aggregationOfResources": [
    "urn:ngsi-ld:Resource:002"
  ]
}
